{
  "$schema": "http://json-schema.org/draft-04/schema#",
  "additionalProperties": false,
  "category": "medical_history",
  "description": "Information about the subject obtained in the context of examination, questioning or during a procedure.",
  "id": "observation",
  "links": [
    {
      "backref": "observations",
      "label": "related_to",
      "multiplicity": "many_to_one",
      "name": "cases",
      "required": true,
      "target_type": "case"
    },
    {
      "name": "timepoints",
      "target_type": "timepoint",
      "backref": "nmmi_observation_timepoints",
      "label": "related_to",
      "multiplicity": "many_to_many",
      "required": false
    },
    {
      "name": "provenance_records",
      "target_type": "provenance",
      "backref": "nmmi_observation_provenance_records",
      "label": "related_to",
      "multiplicity": "many_to_many",
      "required": false
    }
  ],
  "namespace": "https://data.midrc.org/",
  "program": "*",
  "project": "*",
  "properties": {
    "case_ids": {
      "description": "A list of one or more case submitter_ids associated with this data.",
      "items": {
        "type": "string"
      },
      "type": "array"
    },
    "cases": {
      "anyOf": [
        {
          "items": {
            "additionalProperties": true,
            "maxItems": 1,
            "minItems": 1,
            "properties": {
              "id": {
                "pattern": "^[a-fA-F0-9]{8}-[a-fA-F0-9]{4}-[a-fA-F0-9]{4}-[a-fA-F0-9]{4}-[a-fA-F0-9]{12}$",
                "term": {
                  "description": "A 128-bit identifier. Depending on the mechanism used to generate it, it is either guaranteed to be different from all other UUIDs/GUIDs generated until 3400 AD or extremely likely to be different. Its relatively small size lends itself well to sorting, ordering, and hashing of all sorts, storing in databases, simple allocation, and ease of programming in general.\n",
                  "termDef": {
                    "cde_id": "C54100",
                    "cde_version": null,
                    "source": "NCIt",
                    "term": "Universally Unique Identifier",
                    "term_url": "https://ncit.nci.nih.gov/ncitbrowser/ConceptReport.jsp?dictionary=NCI_Thesaurus&version=16.02d&ns=NCI_Thesaurus&code=C54100"
                  }
                },
                "type": "string"
              },
              "submitter_id": {
                "type": "string"
              }
            },
            "type": "object"
          },
          "type": "array"
        },
        {
          "additionalProperties": true,
          "properties": {
            "id": {
              "pattern": "^[a-fA-F0-9]{8}-[a-fA-F0-9]{4}-[a-fA-F0-9]{4}-[a-fA-F0-9]{4}-[a-fA-F0-9]{12}$",
              "term": {
                "description": "A 128-bit identifier. Depending on the mechanism used to generate it, it is either guaranteed to be different from all other UUIDs/GUIDs generated until 3400 AD or extremely likely to be different. Its relatively small size lends itself well to sorting, ordering, and hashing of all sorts, storing in databases, simple allocation, and ease of programming in general.\n",
                "termDef": {
                  "cde_id": "C54100",
                  "cde_version": null,
                  "source": "NCIt",
                  "term": "Universally Unique Identifier",
                  "term_url": "https://ncit.nci.nih.gov/ncitbrowser/ConceptReport.jsp?dictionary=NCI_Thesaurus&version=16.02d&ns=NCI_Thesaurus&code=C54100"
                }
              },
              "type": "string"
            },
            "submitter_id": {
              "type": "string"
            }
          },
          "type": "object"
        }
      ]
    },
    "created_datetime": {
      "oneOf": [
        {
          "format": "date-time",
          "type": "string"
        },
        {
          "type": "null"
        }
      ],
      "term": {
        "description": "A combination of date and time of day in the form [-]CCYY-MM-DDThh:mm:ss[Z|(+|-)hh:mm]\n"
      }
    },
    "days_to_observation": {
      "description": "The number of days from the index date to the date of the observation.",
      "type": "integer"
    },
    "id": {
      "pattern": "^[a-fA-F0-9]{8}-[a-fA-F0-9]{4}-[a-fA-F0-9]{4}-[a-fA-F0-9]{4}-[a-fA-F0-9]{12}$",
      "systemAlias": "node_id",
      "term": {
        "description": "A 128-bit identifier. Depending on the mechanism used to generate it, it is either guaranteed to be different from all other UUIDs/GUIDs generated until 3400 AD or extremely likely to be different. Its relatively small size lends itself well to sorting, ordering, and hashing of all sorts, storing in databases, simple allocation, and ease of programming in general.\n",
        "termDef": {
          "cde_id": "C54100",
          "cde_version": null,
          "source": "NCIt",
          "term": "Universally Unique Identifier",
          "term_url": "https://ncit.nci.nih.gov/ncitbrowser/ConceptReport.jsp?dictionary=NCI_Thesaurus&version=16.02d&ns=NCI_Thesaurus&code=C54100"
        }
      },
      "type": "string"
    },
    "observation_answer": {
      "description": "The answer or value provided for a specific observation about a subject obtained in the context of examination, questioning or during a procedure.",
      "type": "string"
    },
    "observation_name": {
      "description": "The short name of the observation about the subject obtained in the context of examination, questioning or a during procedure.",
      "type": "string"
    },
    "project_id": {
      "term": {
        "description": "Unique ID for any specific defined piece of work that is undertaken or attempted to meet a single requirement.\n"
      },
      "type": "string"
    },
    "state": {
      "default": "validated",
      "downloadable": [
        "uploaded",
        "md5summed",
        "validating",
        "validated",
        "error",
        "invalid",
        "released"
      ],
      "oneOf": [
        {
          "enum": [
            "uploading",
            "uploaded",
            "md5summing",
            "md5summed",
            "validating",
            "error",
            "invalid",
            "suppressed",
            "redacted",
            "live"
          ]
        },
        {
          "enum": [
            "validated",
            "submitted",
            "released"
          ]
        }
      ],
      "public": [
        "live"
      ],
      "term": {
        "description": "The current state of the object.\n"
      }
    },
    "submitter_id": {
      "description": "A human-readable, unique identifier for a record in the metadata database. It can be used in place of the UUID for identifying or recalling a record (e.g., in data queries or uploads/exports).",
      "type": "string"
    },
    "type": {
      "description": "The node_id of the node in the data model; the name of the node used in queries and API requests (e.g., \"aligned_reads_file\" for the \"Aligned Reads File\" node).",
      "type": "string"
    },
    "updated_datetime": {
      "oneOf": [
        {
          "format": "date-time",
          "type": "string"
        },
        {
          "type": "null"
        }
      ],
      "term": {
        "description": "A combination of date and time of day in the form [-]CCYY-MM-DDThh:mm:ss[Z|(+|-)hh:mm]\n"
      }
    },
    "model_version": {
      "type": "string",
      "description": "Version of the submitting theranostics extension, independently of the MIDRC baseline version."
    },
    "record_status": {
      "type": "string",
      "description": "Record curation state, independent of clinical value.",
      "enum": [
        "draft",
        "reviewed",
        "approved",
        "superseded",
        "withdrawn"
      ]
    },
    "source_record_id": {
      "type": "string",
      "description": "Identifier of the originating source record; use an approved pseudonym when needed."
    },
    "source_system": {
      "type": "string",
      "description": "Source system or data provider."
    },
    "missing_properties": {
      "type": "array",
      "description": "Names of properties missing from this record; no missing value is encoded as zero.",
      "items": {
        "type": "string"
      }
    },
    "missing_reasons": {
      "type": "array",
      "description": "Reasons corresponding by index to missing_properties.",
      "items": {
        "enum": [
          "unknown",
          "not_collected",
          "not_applicable",
          "not_available",
          "withheld",
          "pending"
        ]
      }
    },
    "assessment_datetime": {
      "type": "string",
      "description": "ISO 8601 assessment datetime; use approved date shifting consistently within the case.",
      "format": "date-time"
    },
    "days_from_course_start": {
      "type": "number",
      "description": "Signed elapsed days from the linked therapy course start."
    },
    "time_basis": {
      "type": "string",
      "description": "Interpretation of stored dates and elapsed times.",
      "enum": [
        "actual",
        "shifted",
        "relative_only",
        "unknown"
      ]
    },
    "time_window_start_day": {
      "type": "number",
      "description": "Beginning of assessment window relative to course start, in days."
    },
    "time_window_end_day": {
      "type": "number",
      "description": "End of assessment window relative to course start, in days."
    },
    "timepoints": {
      "anyOf": [
        {
          "type": "object",
          "additionalProperties": false,
          "properties": {
            "submitter_id": {
              "type": "string",
              "minLength": 1
            },
            "id": {
              "pattern": "^[a-fA-F0-9]{8}-[a-fA-F0-9]{4}-[a-fA-F0-9]{4}-[a-fA-F0-9]{4}-[a-fA-F0-9]{12}$",
              "term": {
                "description": "A 128-bit identifier. Depending on the mechanism used to generate it, it is either guaranteed to be different from all other UUIDs/GUIDs generated until 3400 AD or extremely likely to be different. Its relatively small size lends itself well to sorting, ordering, and hashing of all sorts, storing in databases, simple allocation, and ease of programming in general.\n",
                "termDef": {
                  "cde_id": "C54100",
                  "cde_version": null,
                  "source": "NCIt",
                  "term": "Universally Unique Identifier",
                  "term_url": "https://ncit.nci.nih.gov/ncitbrowser/ConceptReport.jsp?dictionary=NCI_Thesaurus&version=16.02d&ns=NCI_Thesaurus&code=C54100"
                }
              },
              "type": "string"
            }
          },
          "anyOf": [
            {
              "required": [
                "submitter_id"
              ]
            },
            {
              "required": [
                "id"
              ]
            }
          ]
        },
        {
          "type": "array",
          "items": {
            "type": "object",
            "additionalProperties": false,
            "properties": {
              "submitter_id": {
                "type": "string",
                "minLength": 1
              },
              "id": {
                "pattern": "^[a-fA-F0-9]{8}-[a-fA-F0-9]{4}-[a-fA-F0-9]{4}-[a-fA-F0-9]{4}-[a-fA-F0-9]{12}$",
                "term": {
                  "description": "A 128-bit identifier. Depending on the mechanism used to generate it, it is either guaranteed to be different from all other UUIDs/GUIDs generated until 3400 AD or extremely likely to be different. Its relatively small size lends itself well to sorting, ordering, and hashing of all sorts, storing in databases, simple allocation, and ease of programming in general.\n",
                  "termDef": {
                    "cde_id": "C54100",
                    "cde_version": null,
                    "source": "NCIt",
                    "term": "Universally Unique Identifier",
                    "term_url": "https://ncit.nci.nih.gov/ncitbrowser/ConceptReport.jsp?dictionary=NCI_Thesaurus&version=16.02d&ns=NCI_Thesaurus&code=C54100"
                  }
                },
                "type": "string"
              }
            },
            "anyOf": [
              {
                "required": [
                  "submitter_id"
                ]
              },
              {
                "required": [
                  "id"
                ]
              }
            ]
          },
          "minItems": 1
        }
      ]
    },
    "provenance_records": {
      "anyOf": [
        {
          "type": "object",
          "additionalProperties": false,
          "properties": {
            "submitter_id": {
              "type": "string",
              "minLength": 1
            },
            "id": {
              "pattern": "^[a-fA-F0-9]{8}-[a-fA-F0-9]{4}-[a-fA-F0-9]{4}-[a-fA-F0-9]{4}-[a-fA-F0-9]{12}$",
              "term": {
                "description": "A 128-bit identifier. Depending on the mechanism used to generate it, it is either guaranteed to be different from all other UUIDs/GUIDs generated until 3400 AD or extremely likely to be different. Its relatively small size lends itself well to sorting, ordering, and hashing of all sorts, storing in databases, simple allocation, and ease of programming in general.\n",
                "termDef": {
                  "cde_id": "C54100",
                  "cde_version": null,
                  "source": "NCIt",
                  "term": "Universally Unique Identifier",
                  "term_url": "https://ncit.nci.nih.gov/ncitbrowser/ConceptReport.jsp?dictionary=NCI_Thesaurus&version=16.02d&ns=NCI_Thesaurus&code=C54100"
                }
              },
              "type": "string"
            }
          },
          "anyOf": [
            {
              "required": [
                "submitter_id"
              ]
            },
            {
              "required": [
                "id"
              ]
            }
          ]
        },
        {
          "type": "array",
          "items": {
            "type": "object",
            "additionalProperties": false,
            "properties": {
              "submitter_id": {
                "type": "string",
                "minLength": 1
              },
              "id": {
                "pattern": "^[a-fA-F0-9]{8}-[a-fA-F0-9]{4}-[a-fA-F0-9]{4}-[a-fA-F0-9]{4}-[a-fA-F0-9]{12}$",
                "term": {
                  "description": "A 128-bit identifier. Depending on the mechanism used to generate it, it is either guaranteed to be different from all other UUIDs/GUIDs generated until 3400 AD or extremely likely to be different. Its relatively small size lends itself well to sorting, ordering, and hashing of all sorts, storing in databases, simple allocation, and ease of programming in general.\n",
                  "termDef": {
                    "cde_id": "C54100",
                    "cde_version": null,
                    "source": "NCIt",
                    "term": "Universally Unique Identifier",
                    "term_url": "https://ncit.nci.nih.gov/ncitbrowser/ConceptReport.jsp?dictionary=NCI_Thesaurus&version=16.02d&ns=NCI_Thesaurus&code=C54100"
                  }
                },
                "type": "string"
              }
            },
            "anyOf": [
              {
                "required": [
                  "submitter_id"
                ]
              },
              {
                "required": [
                  "id"
                ]
              }
            ]
          },
          "minItems": 1
        }
      ]
    },
    "observation_profile": {
      "type": "string",
      "description": "Optional collection profile; behavior records use lifestyle."
    },
    "observation_unit": {
      "type": "string",
      "description": "Unit, when the source behavior observation expresses a quantity."
    }
  },
  "required": [
    "submitter_id",
    "type",
    "cases"
  ],
  "submittable": true,
  "systemProperties": [
    "id",
    "project_id",
    "state",
    "created_datetime",
    "updated_datetime"
  ],
  "title": "Observation",
  "type": "object",
  "uniqueKeys": [
    [
      "id"
    ],
    [
      "project_id",
      "submitter_id"
    ]
  ],
  "validators": null
}
